{
  "season": 2026,
  "updated_utc": "2026-10-11T23:23:09Z",
  "snapshot_utc": "2026-10-11T13:56:31Z",
  "source": "nflverse_depth_charts_2026 (latest snapshot, pos_rank 1) + nflverse_rosters_2026 (years_exp == 0)",
  "players": [
    {
      "gsis_id": "00-0041027",
      "name": "Jeremiyah Love",
      "team": "ARI",
      "position": "RB",
      "slot": "11",
      "role_unsettled": true,
      "sos": 3.7,
      "bye_week": 14
    },
    {
      "gsis_id": "00-0041032",
      "name": "Kenyon Sadiq",
      "team": "NYJ",
      "position": "TE",
      "slot": "10",
      "role_unsettled": false,
      "sos": 2.9,
      "bye_week": 13
    },
    {
      "gsis_id": "00-0041037",
      "name": "Denzel Boston",
      "team": "CLE",
      "position": "WR",
      "slot": "1",
      "role_unsettled": false,
      "sos": 2.5,
      "bye_week": 11
    },
    {
      "gsis_id": "00-0041438",
      "name": "Carnell Tate",
      "team": "TEN",
      "position": "WR",
      "slot": "1",
      "role_unsettled": false,
      "sos": 2.8,
      "bye_week": 9
    }
  ]
}
